{"access":"unknown","active_turn_id":null,"default_effort":null,"last_event_cursor":null,"latest_turn_id":null,"ledger_head":{"hash":"0000000000000000000000000000000000000000000000000000000000000000","sequence":0},"lifecycle":"starting","pending_requests":[],"run_generation":0,"run_id":"018f0c6a-7b01-7abc-8def-0123456789ab","schema_version":1,"thread_id":null,"writer_authority":"none"}
